{
  "schema_version": "paper_fill_sim_hot_packet_evaluate_v0",
  "type": "paper_fill_sim_stamp",
  "id": "paper-fill-sim-hot-packet-evaluate-v0",
  "paper_only": true,
  "input": {
    "contract": "paper_evaluate_hot_packet_v0",
    "local_json_only": true,
    "rpc": false,
    "observe_jsonl_tail": false,
    "host_extract_required": false,
    "marks_joined": false,
    "stamp": {
      "schema_version": "paper_evaluate_hot_packet_v0",
      "type": "paper_evaluate_stamp",
      "id": "paper-evaluate-hot-packet-v0",
      "paper_only": true,
      "input": {
        "contract": "hot_packet_v0",
        "only_decode_input": true,
        "raw_ws_replay": false,
        "post_hoc_enrich_on_evaluate": false,
        "packet": {
          "schema_version": "hot_packet_v0",
          "type": "hot_packet",
          "paper_only": true,
          "byte_cap": 8192,
          "l1_spine": {
            "signature": "SigExampleLaunchlab",
            "mint": "MintExampleLaunchlab",
            "txType": "create",
            "stream": "subscribeNewToken",
            "source": "pumpportal_ws",
            "commitment": "processed",
            "stage": "bonding",
            "traderPublicKey": "TraderExampleWeakWs",
            "name": "Example",
            "symbol": "EX",
            "uri": "https://example.invalid/meta.json",
            "bondingCurveKey": "CurveExample",
            "initialBuy": 1000.0,
            "solAmount": 0.1,
            "vTokensInBondingCurve": 1000000.0,
            "vSolInBondingCurve": 30.0,
            "marketCapSol": 30.0,
            "pool": null
          },
          "regime": {
            "regime_id": "env=mainnet|source=pumpportal_ws|stream=subscribeNewToken|stage=bonding|quote=wsol|commitment=processed|venue=launchlab|instr=launchlab_init|fee=unverified|market=launchlab_pool",
            "components": {
              "env": "mainnet",
              "source": "pumpportal_ws",
              "stream": "subscribeNewToken",
              "stage": "bonding",
              "quote": "wsol",
              "commitment": "processed",
              "venue": "launchlab",
              "instr": "launchlab_init",
              "fee": "unverified",
              "market": "launchlab_pool"
            },
            "component_lock": {
              "env": "production",
              "source": "production",
              "stream": "production",
              "stage": "production",
              "quote": "production",
              "commitment": "production",
              "venue": "proposed",
              "instr": "proposed",
              "fee": "production",
              "market": "proposed"
            }
          },
          "knowable_at_t": {
            "quote": "wsol",
            "quote_verified": true,
            "instr": "launchlab_init",
            "fee": "unverified",
            "venue": "launchlab",
            "venue_verified": true,
            "creator_verified": false,
            "reserves_source": "ws"
          },
          "graph": {
            "cold": true,
            "max_slots": 5,
            "lane_policy": "exp004_capped_scalars_only",
            "slots": null
          },
          "clocks": {
            "t_ws": "2026-09-20T12:00:00.000+00:00",
            "t_event": null,
            "T_decision": "2026-09-20T12:00:00.000+00:00",
            "t_precompute_as_of": "2026-09-20T12:00:00.000+00:00",
            "precompute_features_merged": false,
            "clock_source": "dec005_draft_pr8_unmerged"
          },
          "delta_exec": {
            "defined_in": "dec005_draft_pr8_unmerged",
            "value": null,
            "reason": "paper_packet_has_no_fill"
          },
          "provenance": {
            "spine": "sealed_jsonl",
            "source_day": "2026-09-20",
            "parent_type": "ingest_hot",
            "parent_schema": "observe_hot_v0",
            "parent_signature": "SigExampleLaunchlab",
            "mint": "MintExampleLaunchlab",
            "fixture_origin": "synthetic",
            "supersedes": null,
            "day_aligned": true
          },
          "dual_read": {
            "overlay": "enriched",
            "sealed_book_rpc_slice": "incomplete",
            "enrich_type": "regime_enrich"
          },
          "honesty": {
            "registration": "proposed",
            "continuous_observe_wiring": false,
            "encoder_promoted": false,
            "enum_production_lock": false,
            "discovery_promoted": false,
            "graph_lane_revived": false,
            "invented_lift": false
          }
        }
      },
      "evaluate_label": "runner",
      "reasons": [],
      "ruleset": "paper_evaluate_hot_packet_v0_rules",
      "knowable_at_t_only": true,
      "graph_lift": null,
      "graph_lift_status": "not_used_graph_cold",
      "runner_stamp": {
        "kind": "paper_promotion",
        "pretend_buy": true,
        "live_capital": false,
        "T": "2026-09-20T12:00:00.000+00:00",
        "clock_source": "dec005_draft_pr8_unmerged",
        "horizons": {
          "1s": null,
          "5s": null,
          "15s": null,
          "30s": null,
          "60s": null,
          "+2s": null,
          "+10s": null,
          "+5m": null,
          "peak": null,
          "drawdown": null
        },
        "horizon_status": "null_ok_no_marks_on_this_stamp",
        "delta_exec": {
          "field": "delta_exec",
          "also_called": "Δ_exec",
          "value": null,
          "status": "null_ok",
          "reason": "paper_stamp_has_no_fill"
        }
      },
      "full_book": {
        "policy": "dec007_both_arms_retained",
        "arm_retained": true,
        "deletes_detect_history": false
      },
      "soft_watches": {
        "blocking": false,
        "source": "hot_packet_v0_soft_gate_pr49",
        "items": [
          "schema_looser_than_cli",
          "synthetic_launchlab_shape",
          "graph_slot_shape_not_a_score",
          "dec005_draft_unmerged",
          "sealed_book_rpc_slice_incomplete"
        ]
      },
      "honesty": {
        "registration": "proposed",
        "scored_oracle_measure": false,
        "continuous_observe_wiring": false,
        "encoder_promoted": false,
        "enum_production_lock": false,
        "discovery_promoted": false,
        "graph_lane_revived": false,
        "invented_lift": false,
        "exp002c_retuned": false,
        "live_capital": false,
        "trading_keys": false,
        "pumpportal_trade_api": false
      }
    }
  },
  "parent_evaluate": {
    "id": "paper-evaluate-hot-packet-v0",
    "schema_version": "paper_evaluate_hot_packet_v0",
    "pull_request": 50,
    "commit": "224166c",
    "cli": "python -m tools.paper_evaluate_hot_packet_v0",
    "rewritten_by_this_stamp": false
  },
  "exp006_vocabulary": {
    "exp_id": "EXP-006-paper-would-have-happened-harness-v0",
    "cli": "python -m tools.exp006_paper_fill_sim",
    "harness_rewritten": false,
    "oracle_run": false,
    "promoted": false,
    "vocabulary_only": true
  },
  "evaluate_label": "runner",
  "reasons": [],
  "fill_model": {
    "latency_ms": 500,
    "paper_size_sol": 0.1,
    "fee_model_id": "pump_assumed_bps_v0",
    "total_fee_bps": 125.0,
    "max_slippage_bps": 500.0,
    "sim_reject_on_slip": true,
    "source": "documented_constants_exp006_p0",
    "fitted_to_lift": false,
    "vocabulary_from": "EXP-006-paper-would-have-happened-harness-v0"
  },
  "fill_sim": {
    "status": "documented_model_only",
    "pretend_buy": true,
    "fill_status": null,
    "t_fill": null,
    "fill_price_proxy": null,
    "fee_sol": null,
    "slippage_bps": null,
    "notes": "Documented EXP-006 P0 constants only. No marks joined. No scored fill on this registration."
  },
  "graph_lift": null,
  "graph_lift_status": "not_used_graph_cold",
  "graph_policy": "cold",
  "horizons": {
    "status": "fill_sim_registration_null_explicit",
    "null_is_not_zero_return": true,
    "source": "parent_evaluate_runner_stamp_and_fill_sim_registration",
    "values": {
      "1s": null,
      "5s": null,
      "15s": null,
      "30s": null,
      "60s": null,
      "+2s": null,
      "+10s": null,
      "+5m": null,
      "peak": null,
      "drawdown": null
    }
  },
  "delta_exec": {
    "field": "delta_exec",
    "also_called": "Δ_exec",
    "value": null,
    "status": "fill_sim_registration_null_explicit",
    "reason": "fill_sim_stamp_has_no_scored_delta",
    "null_is_not_zero_cost": true
  },
  "dual_read": {
    "sealed_book_rpc_slice": "incomplete",
    "closed_book_claim": false,
    "incomplete_reason": "fill_sim_bind_does_not_close_the_sealed_book"
  },
  "full_book": {
    "policy": "dec007_both_arms_retained",
    "arm_retained": true,
    "deletes_detect_history": false,
    "reject_stamps_dropped": 0
  },
  "measure": {
    "kind": "none",
    "claims_alpha": false,
    "invented_ev": false,
    "invented_lift": false,
    "pass_fail_no_lift": false
  },
  "soft_watches": {
    "blocking": false,
    "source": "hot_packet_v0_soft_gate_pr49_paper_evaluate_pr50_scoreboard_pr51_batch_pr52_dry_run_pr53_schema_align_pr54_dry_run_capture_pr55_fill_sim_hot_packet_evaluate_v0",
    "inherited_from": [
      "hot_packet_v0_soft_gate_pr49",
      "paper_evaluate_hot_packet_v0_pr50",
      "paper_scoreboard_sealed_fixture_v0_pr51",
      "paper_batch_oracle_sealed_day_incomplete_rpc_v0_pr52",
      "paper_batch_host_local_sealed_jsonl_dry_run_incomplete_rpc_v0_pr53",
      "paper_incomplete_rpc_honesty_schema_align_v0_pr54",
      "paper_host_local_dry_run_receipt_capture_v0_pr55"
    ],
    "items": [
      "schema_looser_than_cli",
      "synthetic_launchlab_shape",
      "graph_slot_shape_not_a_score",
      "dec005_draft_unmerged",
      "sealed_book_rpc_slice_incomplete",
      "label_share_is_not_a_return",
      "synthetic_sealed_day_not_a_host_extract",
      "local_subset_is_not_dropped_history",
      "host_jsonl_not_readable_from_ci",